{
  "apiVersion": "cost-workbench/v2",
  "kind": "CostSnapshotRequest",
  "requestId": "req_fixture_cost_v2",
  "actor": { "type": "agent", "id": "cost-workbench-skill" },
  "data": {
    "schemaVersion": "2.0.0",
    "exportedAt": "2026-09-04T08:00:00.000Z",
    "project": {
      "id": "PRJ-2026-018",
      "name": "Xinglan Retail Cloud Migration",
      "client": "Xinglan Retail",
      "currency": "SGD"
    },
    "costVersion": { "code": "V3", "status": "Pending freeze" },
    "rateSettings": {
      "quoteAsOf": "2026-09-04",
      "tdStart": "2027-03-15",
      "tdEnd": "2031-12-31",
      "baseYear": 2026,
      "defaultUplift": 5,
      "annualUplifts": [5, 5, 5, 5, 5]
    },
    "travelSettings": {
      "monthlyAllowance": 4200,
      "airfarePerTrip": 850,
      "trips": 4
    },
    "resourceTypes": [
      {
        "id": "rt-hq-l1",
        "code": "HQ-L1",
        "name": "HQ L1",
        "category": "internal",
        "pool": "HQ",
        "level": "L1",
        "mandayRate": 1800,
        "mandaysPerMonth": 21.75,
        "hoursPerManday": 8,
        "hqTravel": true,
        "effectiveFrom": "2026-01-01",
        "effectiveTo": "",
        "active": true
      },
      {
        "id": "rt-hq-l2",
        "code": "HQ-L2",
        "name": "HQ L2",
        "category": "internal",
        "pool": "HQ",
        "level": "L2",
        "mandayRate": 2200,
        "mandaysPerMonth": 21.75,
        "hoursPerManday": 8,
        "hqTravel": true,
        "effectiveFrom": "2026-01-01",
        "effectiveTo": "",
        "active": true
      },
      {
        "id": "rt-hq-l3",
        "code": "HQ-L3",
        "name": "HQ L3",
        "category": "internal",
        "pool": "HQ",
        "level": "L3",
        "mandayRate": 2600,
        "mandaysPerMonth": 21.75,
        "hoursPerManday": 8,
        "hqTravel": true,
        "effectiveFrom": "2026-01-01",
        "effectiveTo": "",
        "active": true
      },
      {
        "id": "rt-hq-l4",
        "code": "HQ-L4",
        "name": "HQ L4",
        "category": "internal",
        "pool": "HQ",
        "level": "L4",
        "mandayRate": 3000,
        "mandaysPerMonth": 21.75,
        "hoursPerManday": 8,
        "hqTravel": true,
        "effectiveFrom": "2026-01-01",
        "effectiveTo": "",
        "active": true
      },
      {
        "id": "rt-local-l1",
        "code": "LOCAL-L1",
        "name": "Local L1",
        "category": "internal",
        "pool": "LOCAL",
        "level": "L1",
        "mandayRate": 600,
        "mandaysPerMonth": 21.75,
        "hoursPerManday": 8,
        "hqTravel": false,
        "effectiveFrom": "2026-01-01",
        "effectiveTo": "",
        "active": true
      },
      {
        "id": "rt-local-l2",
        "code": "LOCAL-L2",
        "name": "Local L2",
        "category": "internal",
        "pool": "LOCAL",
        "level": "L2",
        "mandayRate": 750,
        "mandaysPerMonth": 21.75,
        "hoursPerManday": 8,
        "hqTravel": false,
        "effectiveFrom": "2026-01-01",
        "effectiveTo": "",
        "active": true
      },
      {
        "id": "rt-local-l3",
        "code": "LOCAL-L3",
        "name": "Local L3",
        "category": "internal",
        "pool": "LOCAL",
        "level": "L3",
        "mandayRate": 900,
        "mandaysPerMonth": 21.75,
        "hoursPerManday": 8,
        "hqTravel": false,
        "effectiveFrom": "2026-01-01",
        "effectiveTo": "",
        "active": true
      },
      {
        "id": "rt-local-l4",
        "code": "LOCAL-L4",
        "name": "Local L4",
        "category": "internal",
        "pool": "LOCAL",
        "level": "L4",
        "mandayRate": 1100,
        "mandaysPerMonth": 21.75,
        "hoursPerManday": 8,
        "hqTravel": false,
        "effectiveFrom": "2026-01-01",
        "effectiveTo": "",
        "active": true
      },
      {
        "id": "rt-arp-l0",
        "code": "ARP-L0",
        "name": "ARP L0",
        "category": "internal",
        "pool": "ARP",
        "level": "L0",
        "mandayRate": 320,
        "mandaysPerMonth": 21.75,
        "hoursPerManday": 8,
        "hqTravel": false,
        "effectiveFrom": "2026-01-01",
        "effectiveTo": "",
        "active": true
      },
      {
        "id": "rt-arp-l1",
        "code": "ARP-L1",
        "name": "ARP L1",
        "category": "internal",
        "pool": "ARP",
        "level": "L1",
        "mandayRate": 420,
        "mandaysPerMonth": 21.75,
        "hoursPerManday": 8,
        "hqTravel": false,
        "effectiveFrom": "2026-01-01",
        "effectiveTo": "",
        "active": true
      },
      {
        "id": "rt-arp-l2",
        "code": "ARP-L2",
        "name": "ARP L2",
        "category": "internal",
        "pool": "ARP",
        "level": "L2",
        "mandayRate": 520,
        "mandaysPerMonth": 21.75,
        "hoursPerManday": 8,
        "hqTravel": false,
        "effectiveFrom": "2026-01-01",
        "effectiveTo": "",
        "active": true
      },
      {
        "id": "rt-arp-l3",
        "code": "ARP-L3",
        "name": "ARP L3",
        "category": "internal",
        "pool": "ARP",
        "level": "L3",
        "mandayRate": 650,
        "mandaysPerMonth": 21.75,
        "hoursPerManday": 8,
        "hqTravel": false,
        "effectiveFrom": "2026-01-01",
        "effectiveTo": "",
        "active": true
      },
      {
        "id": "rt-arp-l4",
        "code": "ARP-L4",
        "name": "ARP L4",
        "category": "internal",
        "pool": "ARP",
        "level": "L4",
        "mandayRate": 800,
        "mandaysPerMonth": 21.75,
        "hoursPerManday": 8,
        "hqTravel": false,
        "effectiveFrom": "2026-01-01",
        "effectiveTo": "",
        "active": true
      },
      {
        "id": "rt-subcon",
        "code": "SUBCON",
        "name": "Subcontract Package",
        "category": "subcontract",
        "pool": null,
        "level": null,
        "mandayRate": 0,
        "mandaysPerMonth": 21.75,
        "hoursPerManday": 8,
        "hqTravel": false,
        "effectiveFrom": "2026-01-01",
        "effectiveTo": "",
        "active": true
      }
    ],
    "costRows": [
      {
        "id": "CI-001",
        "scope": "Solution Design",
        "bu": "Cloud BU",
        "reTypeId": "rt-hq-l3",
        "mdPerSite": 80,
        "years": [
          { "bucket": "Y1", "sites": 1, "cost": 18848.282 },
          { "bucket": "Y2", "sites": 0, "cost": 0 },
          { "bucket": "Y3", "sites": 0, "cost": 0 },
          { "bucket": "Y4", "sites": 0, "cost": 0 },
          { "bucket": "Y5", "sites": 0, "cost": 0 }
        ]
      }
    ],
    "manualCosts": {
      "localPurchasedEquipment": 0,
      "inlandLogistics": 0,
      "countryWarehousing": 0,
      "nonInHouseLabour": 0,
      "settlement": 0,
      "carFee": 0,
      "otherService": 0,
      "riskContingency": 0
    }
  }
}
